{"schema_version":"formalization-faithfulness-1","role":"roundtrip-judge","task_id":"HDP-02-BODY-2.7-GAUSSIAN-SQUARE-TAIL","source_sha256":"ecc53be86c091b5df118c4464b6d81672e0261df960a3f32ceea4900107d090a","blind_translation_sha256":"c18389bc9bb855f7f328ea5708d2e1f46361b838f59acc2802014b022def1846","semantic_checklist":[{"id":"C01","status":"pass","source_evidence":"The immutable source contains the Section 2.7 opening display and footnote on PDF page 20 (printed page 31), together with Proposition 2.1.2 on PDF page 2 (printed page 13); its SHA-256 matches the locator.","translation_evidence":"The translation concerns the squared tail of a standard real Gaussian and gives the event identity and the Mills-ratio bounds associated with those passages.","reasoning":"The selected source passage, recalled proposition, and translated claim concern the same Gaussian-square tail calculation."},{"id":"C02","status":"pass","source_evidence":"The source places a coordinate g_i of a standard Gaussian vector in the scalar law N(0,1) and uses a positive threshold t.","translation_evidence":"The translation binds an arbitrary real t under 0 < t and evaluates the standard Gaussian measure on scalar real events.","reasoning":"Replacing the coordinate by a scalar sample from its N(0,1) marginal removes irrelevant vector parameters without changing the mathematical object or threshold domain."},{"id":"C03","status":"pass","source_evidence":"The display is a uniform calculation for a coordinate and positive threshold, with no existential witnesses or dependent choices.","translation_evidence":"The proposition is asserted for every real t satisfying 0 < t, and all three conclusions use that same t.","reasoning":"Quantifier scope and parameter dependence are preserved."},{"id":"C04","status":"pass","source_evidence":"Each coordinate has law N(0,1); independence belongs to the surrounding vector context but is not used in the one-coordinate tail calculation. Proposition 2.1.2 requires a positive threshold.","translation_evidence":"The measure is gaussianReal 0 1 and the sole explicit side condition is 0 < t.","reasoning":"The necessary marginal-law and positivity hypotheses match. Omitting coordinate independence does not weaken this one-coordinate statement because the source itself does not use independence in the displayed calculation."},{"id":"C05","status":"pass","source_evidence":"The source gives the squared-event transformation, exponential factor exp(-t/2), and the consequences that the tail is exponential-type and strictly heavier than sub-gaussian.","translation_evidence":"The translation gives the exact event-probability identity and two-sided bounds with polynomial factor t^(-1/2), lower-order correction, and exp(-t/2).","reasoning":"The quantitative bounds imply exponential rate -1/2 and, through their eventual positive lower bound, the stated heavier-than-sub-gaussian conclusion. Thus the source's qualitative conclusions are represented as consequences rather than omitted."},{"id":"C06","status":"pass","source_evidence":"The source uses scalar Gaussian probability, absolute value, square root, exponentiation, and the normal-tail estimate from Proposition 2.1.2.","translation_evidence":"The D001-D051 ledger identifies gaussianReal 0 1, Measure.real, real absolute value, real square root, natural powers, real exponential, set events, and ordinary real arithmetic and order; every ledger entry is marked understood.","reasoning":"The translated operators have the intended standard-real and finite-probability meanings, with no unresolved dependency semantics."},{"id":"C07","status":"pass","source_evidence":"Section 2.7 uses strict events g_i^2 > t and |g| > sqrt(t); Proposition 2.1.2 supplies non-strict lower and upper numerical inequalities for a one-sided Gaussian tail.","translation_evidence":"Both translated events are strict, their measures are equal, and the lower and upper analytic comparisons use non-strict ≤ in the same directions.","reasoning":"The logical connectives, equality, inequality directions, and strictness match. The source proposition's ≥ event versus the translated > event causes no probability difference for the atomless normal law."},{"id":"C08","status":"pass","source_evidence":"Although the surrounding symbol g denotes a vector, the middle term of the display must denote a scalar standard-normal representative of the coordinate law, not the vector norm.","translation_evidence":"The translated events range over x : Real under the scalar standard Gaussian measure.","reasoning":"The translation correctly preserves the coordinate's marginal role and avoids conflating it with the Euclidean norm of the vector."},{"id":"C09","status":"pass","source_evidence":"Proposition 2.1.2 has normalization 1/sqrt(2π), factors 1/u and 1/u^3, and exponent exp(-u^2/2); Section 2.7 substitutes u = sqrt(t).","translation_evidence":"The bounds use 2/sqrt(2π), the factors 1/sqrt(t) and 1/(sqrt(t))^3, and exp(-t/2).","reasoning":"Substitution u = sqrt(t) gives the translated powers and exponent, while the factor 2 correctly accounts for the two symmetric Gaussian tails. The translation follows the proposition's t^(-1/2) polynomial scale rather than the imprecise 1/t wording of footnote 6."},{"id":"C10","status":"pass","source_evidence":"The source calculation depends only on one N(0,1) coordinate, even though it is introduced inside an arbitrary finite-dimensional standard Gaussian vector.","translation_evidence":"The translation states the corresponding theorem directly for the scalar standard Gaussian measure.","reasoning":"This marginal reduction is mathematically equivalent for the selected claim and neither changes the scalar field nor restricts the relevant distribution or threshold domain."},{"id":"C11","status":"pass","source_evidence":"The square-root substitution and Proposition 2.1.2 use positive thresholds; normal atomlessness reconciles strict and non-strict tail conventions.","translation_evidence":"The translation explicitly assumes 0 < t. It notes that the lower expression is nonpositive and hence trivial when 0 < t ≤ 1, while all operations remain defined.","reasoning":"Boundary and small-threshold cases are handled consistently. The trivial lower estimate for small positive t is also a valid consequence of the source proposition, not an unintended exclusion."},{"id":"C12","status":"pass","source_evidence":"Standard Gaussian coordinates exist, and their squared-tail probability is nonzero for every finite positive threshold; the cited Mills bounds are informative for large thresholds.","translation_evidence":"gaussianReal 0 1 is a finite probability measure, positive thresholds are available, and the upper bound and event identity remain substantive even where the lower bound is trivial.","reasoning":"The hypotheses are satisfiable and the claim is not rendered true by an impossible premise or infinite-measure conversion artifact."}],"implications":{"translation_implies_source":{"verdict":"yes","reasoning":"The exact event identity supplies the source's first equality. The two-sided Mills bounds give P{x²>t}=Θ(t^(-1/2)exp(-t/2)) as t tends to infinity, hence logarithmic decay rate -1/2 and the source's intended exponential-scale comparison rather than ratio equivalence to exp(-t/2). Their eventual positive lower bound also establishes that this tail is strictly heavier than a sub-gaussian tail."},"source_implies_translation":{"verdict":"yes","reasoning":"For u=sqrt(t)>0, Proposition 2.1.2 gives the translated one-sided lower and upper expressions. Symmetry of N(0,1) doubles them for |g|>u, atomlessness permits replacing ≥ by > in probability, and g²>t is equivalent to |g|>sqrt(t). This yields the translated equality and both exact bounds for every t>0."}},"classification":"faithful-equivalent","accepted":true,"requires_adjudication":false,"findings":[],"rationale":"The blind translation makes the source's informal exponential-scale statement precise using the very Mills-ratio proposition recalled by the passage. Its scalar formulation is equivalent to the one-coordinate vector formulation, its constants and threshold substitution are correct, and the D001-D051 dependency ledger leaves no unresolved semantic meaning. Both implication directions hold, so no adjudication is required."}
