{"schema_version":"formalization-faithfulness-1","role":"roundtrip-judge","task_id":"HDP-01-EQ-1.7","source_sha256":"855fdaf6870f664f1e470d47641b6d72758afdb9b87649a6494b027cecc02b17","blind_translation_sha256":"c5ed1ff32c0fbb73edcbe6625ab109d0e24ab801c6939a8fe9d79f0e196fd643","semantic_checklist":[{"id":"C01","status":"pass","source_evidence":"The source fixes p with 0 < p < 1.","translation_evidence":"The translation assumes the same strict bounds.","reasoning":"The parameter range is preserved."},{"id":"C02","status":"pass","source_evidence":"The source uses an iid sequence.","translation_evidence":"The translation states mutual independence and equality in distribution.","reasoning":"The iid structure is preserved."},{"id":"C03","status":"fail","source_evidence":"Each source summand has Bernoulli(p) law and support {0,1}.","translation_evidence":"The translation assumes only L2, iid, mean p, and variance p(1-p).","reasoning":"The mandatory Bernoulli-law premise is absent."},{"id":"C04","status":"pass","source_evidence":"Bernoulli(p) has mean p and variance p(1-p).","translation_evidence":"The translation states these two moment identities.","reasoning":"The source moments are preserved."},{"id":"C05","status":"fail","source_evidence":"The source sum is binomial because the summands are Bernoulli.","translation_evidence":"The translation permits arbitrary iid L2 laws with matching moments.","reasoning":"Moments do not characterize the Bernoulli law."},{"id":"C06","status":"pass","source_evidence":"The source uses the first N summands.","translation_evidence":"The translation uses a zero-based N+1 reparameterization.","reasoning":"This indexing shift is harmless for the limit."},{"id":"C07","status":"pass","source_evidence":"The source centers by Np.","translation_evidence":"The translated N+1-term sum is centered by (N+1)p.","reasoning":"Centering agrees after reparameterization."},{"id":"C08","status":"pass","source_evidence":"The source scales by sqrt(Np(1-p)).","translation_evidence":"The translated scale is sqrt((N+1)p(1-p)).","reasoning":"Scaling agrees after reparameterization."},{"id":"C09","status":"pass","source_evidence":"The target law is N(0,1).","translation_evidence":"The translation names the standard Gaussian probability measure.","reasoning":"The limiting law is preserved."},{"id":"C10","status":"pass","source_evidence":"The arrow denotes convergence in distribution.","translation_evidence":"The translation states weak convergence of pushforward laws.","reasoning":"The convergence mode is preserved."},{"id":"C11","status":"pass","source_evidence":"Positive N and 0 < p < 1 make the scale nonzero.","translation_evidence":"The translation retains the strict bounds and uses N+1.","reasoning":"The normalized expression is well-defined."},{"id":"C12","status":"fail","source_evidence":"Equation (1.7) is specifically the Bernoulli/binomial de Moivre-Laplace result.","translation_evidence":"Round-tripping yields a general iid finite-variance CLT with prescribed moments.","reasoning":"The source theorem's special-model identity is not recovered."}],"implications":{"translation_implies_source":{"verdict":"yes","reasoning":"Iid Bernoulli(p) variables satisfy all translated premises, modulo harmless indexing reparameterization."},"source_implies_translation":{"verdict":"no","reasoning":"The Bernoulli special case does not prove the translated theorem for arbitrary iid L2 distributions with the same moments."}},"classification":"faithful-stronger","accepted":true,"requires_adjudication":true,"findings":[{"severity":"major","category":"omitted-source-hypothesis","source_evidence":"The source requires every X_i to have Bernoulli(p) law.","translation_evidence":"No Bernoulli-valued or two-point-support hypothesis appears.","impact":"The translated theorem has a materially broader domain, even though it specializes to the source theorem."},{"severity":"major","category":"scope-strengthening","source_evidence":"The source presents the Bernoulli de Moivre-Laplace special case.","translation_evidence":"The translation applies to arbitrary iid L2 real variables with matching moments.","impact":"The translation changes the theorem's source-specific identity while logically strengthening its scope."},{"severity":"minor","category":"index-reparameterization","source_evidence":"The source sums N variables from 1 through N.","translation_evidence":"The translation uses N+1 variables from 0 through N.","impact":"The difference is asymptotically harmless."}],"rationale":"The evidence supports translation_implies_source=yes and source_implies_translation=no: the translated general iid theorem specializes to the Bernoulli result, while the Bernoulli result does not recover the general theorem. Under the installed schema, that pair mechanically classifies the judgment as faithful-stronger and requires accepted=true. This schema-level acceptance does not erase the substantive concern: the Bernoulli/two-point-support premise and de Moivre-Laplace identity were omitted, so adjudication remains requested."}
