{
  "schema_version": "formalization-faithfulness-1",
  "role": "roundtrip-judge",
  "task_id": "HDP-01-EXERCISE-1.3.3",
  "source_sha256": "855fdaf6870f664f1e470d47641b6d72758afdb9b87649a6494b027cecc02b17",
  "blind_translation_sha256": "43a0643b3485c858edc998637fe1d32e46ab177339304ee2973e305ad0ee88be",
  "semantic_checklist": [
    {
      "id": "C01",
      "status": "pass",
      "source_evidence": "The source concerns a sequence of real-valued random variables on an implicit probability space.",
      "translation_evidence": "The translation binds a measurable space Ω, a probability measure μ, and X : Nat → Ω → Real.",
      "reasoning": "The explicit ambient structures faithfully formalize the source's implicit probabilistic and real-valued context."
    },
    {
      "id": "C02",
      "status": "pass",
      "source_evidence": "The source assumes an infinite identically distributed sequence X₁, X₂, ... .",
      "translation_evidence": "The translation assumes IdentDistrib (X i) (X 0) μ μ for every natural index i.",
      "reasoning": "Comparison with X₀ gives every variable the same law, matching identical distribution up to the harmless zero-based reindexing."
    },
    {
      "id": "C03",
      "status": "pass",
      "source_evidence": "The source says the sequence is i.i.d., conventionally requiring joint independence of every finite subfamily.",
      "translation_evidence": "The translation assumes IndepFun (X i) (X j) μ only for each pair of distinct indices.",
      "reasoning": "Pairwise independence is weaker than source-level joint independence, but this makes the translated theorem stronger: every jointly independent source sequence satisfies the translated independence hypothesis, and pairwise independence suffices for the variance estimate underlying this conclusion."
    },
    {
      "id": "C04",
      "status": "pass",
      "source_evidence": "The source assumes a common mean μ.",
      "translation_evidence": "The translation centers at the Bochner integral ∫ X₀ dμ, while IdentDistrib relates every Xᵢ to X₀.",
      "reasoning": "Square integrability supplies integrability, and identical distribution makes the integral of X₀ the common mean. Using the measure symbol μ and an integral rather than a separately bound mean is semantically harmless."
    },
    {
      "id": "C05",
      "status": "pass",
      "source_evidence": "The source assumes finite variance and includes the zero-variance case.",
      "translation_evidence": "The translation requires MeasureTheory.MemLp (X i) 2 μ for every i.",
      "reasoning": "On a probability space, real L² membership gives finite second moment and hence finite variance. The added measurability is standard random-variable structure, and no positive-variance assumption is introduced."
    },
    {
      "id": "C06",
      "status": "pass",
      "source_evidence": "The source averages the first N variables with normalization 1/N and indices 1 through N.",
      "translation_evidence": "For parameter N, the translation averages X₀ through X_N using Fin (N+1) and normalization 1/(N+1).",
      "reasoning": "Setting the source sample size n=N+1 yields exactly the same positive-size empirical average after shifting indices by one."
    },
    {
      "id": "C07",
      "status": "pass",
      "source_evidence": "The source centers the sample mean by subtracting the common mean.",
      "translation_evidence": "The translated integrand subtracts ∫ X₀ dμ from the empirical mean.",
      "reasoning": "Identical distribution and L² membership identify this integral with the common mean, so the centering is faithful."
    },
    {
      "id": "C08",
      "status": "pass",
      "source_evidence": "The source asks for E[|sample mean − μ|], with absolute value inside expectation.",
      "translation_evidence": "The translation takes the outer integral of the pointwise absolute empirical-mean error.",
      "reasoning": "This is the expectation of absolute error, not the absolute value of a signed expectation or an almost-sure error."
    },
    {
      "id": "C09",
      "status": "pass",
      "source_evidence": "The source rate is O(1/√N) as N tends to infinity.",
      "translation_evidence": "The translation uses Asymptotics.IsBigO at Filter.atTop against N ↦ 1/√(N+1).",
      "reasoning": "The successor shift is asymptotically equivalent and cofinal, so it preserves the requested inverse-square-root rate."
    },
    {
      "id": "C10",
      "status": "pass",
      "source_evidence": "Big-O means an eventual upper bound with an N-independent constant, not asymptotic equality or a lower bound.",
      "translation_evidence": "IsBigO supplies an eventual norm upper bound by a fixed constant multiple of the comparison function.",
      "reasoning": "Because the expected absolute error and 1/√(N+1) are nonnegative reals, the norm-based IsBigO semantics is precisely the required one-sided eventual upper estimate."
    },
    {
      "id": "C11",
      "status": "pass",
      "source_evidence": "Sample size is positive and tends to infinity through integers; the hidden constant may depend on the common law but not on N.",
      "translation_evidence": "N ranges over Nat at atTop, while the actual sample size is N+1; IsBigO fixes its multiplicative constant independently of N.",
      "reasoning": "The successor parameter prevents division by zero, remains cofinal, and preserves the permitted dependence of the hidden constant."
    },
    {
      "id": "C12",
      "status": "pass",
      "source_evidence": "The source requests only the expected absolute-error upper rate and does not demand an exact constant, lower bound, or other convergence mode.",
      "translation_evidence": "The conclusion contains only the corresponding IsBigO assertion and absorbs variance scale into its hidden constant.",
      "reasoning": "No extra conclusion such as Θ behavior, asymptotic equivalence, almost-sure convergence, or a variance lower bound is asserted."
    }
  ],
  "implications": {
    "translation_implies_source": {
      "verdict": "yes",
      "reasoning": "Every source-level jointly i.i.d. finite-variance sequence is pairwise independent, identically distributed, and L² after the harmless one-based-to-zero-based reindexing. The translated Big-O conclusion for sample size N+1 therefore yields the source conclusion."
    },
    "source_implies_translation": {
      "verdict": "no",
      "reasoning": "As a theorem statement, the source only asserts the estimate under joint independence and does not by itself assert the translated generalization to all pairwise-independent identically distributed sequences, even though that generalization is mathematically valid for this variance-based estimate."
    }
  },
  "classification": "faithful-stronger",
  "accepted": true,
  "requires_adjudication": false,
  "findings": [
    {
      "severity": "minor",
      "category": "faithful-stronger-independence-generalization",
      "source_evidence": "The source uses i.i.d., whose independence component is joint independence of the sequence.",
      "translation_evidence": "The translation assumes only IndepFun for each distinct pair and explicitly identifies this as pairwise independence.",
      "impact": "The translated theorem covers more sequences than the source. This is a sound faithful-stronger generalization for the stated expected absolute-error rate, not a loss of the source case, but it should remain documented rather than described as literal equivalence of hypotheses."
    }
  ],
  "rationale": "The translation preserves the probability-space context, identical law, finite-variance/L² content, common integral center, empirical average, expectation of pointwise absolute error, positive integer sample sizes, and one-sided inverse-square-root Big-O semantics. Its zero-based N+1 formulation is a harmless cofinal reindexing. The sole substantive difference is replacing joint independence by pairwise independence; this weakens the hypothesis and hence strengthens the theorem, while still covering every source instance and remaining sufficient for the standard second-moment proof. The result is therefore accepted as faithful-stronger."
}
