{
  "schema_version": "formalization-faithfulness-1",
  "role": "roundtrip-judge",
  "task_id": "HDP-02-BODY-2.1-SN-MOMENTS",
  "source_sha256": "ecc53be86c091b5df118c4464b6d81672e0261df960a3f32ceea4900107d090a",
  "blind_translation_sha256": "650f9688cfabee89099ba3df0cee7ca5579f8aa1c5f471db25d1a649bad00560",
  "semantic_checklist": [
    {
      "id": "C01",
      "status": "pass",
      "source_evidence": "The selected source is the moment display immediately after Question 2.1.1 on printed page 12, interpreted with the independent Bernoulli(1/2) representation immediately following on printed page 13.",
      "translation_evidence": "The reconstruction describes a finite family of independent fair Boolean variables and the expectation and variance of their indicator sum.",
      "reasoning": "The exact display and its necessary surrounding probabilistic context are correctly selected."
    },
    {
      "id": "C02",
      "status": "pass",
      "source_evidence": "The source implicitly takes a positive integer N, performs N coin tosses, and defines S_N as their number of heads.",
      "translation_evidence": "The reconstruction uses a finite index type of positive cardinality and a Boolean-valued random variable for each index.",
      "reasoning": "A nonempty finite type and Boolean head indicators faithfully represent a positive finite number of coin tosses."
    },
    {
      "id": "C03",
      "status": "pass",
      "source_evidence": "The source identities apply to the fair N-toss experiment for each implicitly positive integer N.",
      "translation_evidence": "The sample space, probability measure, positive finite index type, and family are arbitrary subject to the fair-law and independence hypotheses.",
      "reasoning": "The reconstruction makes the source's implicit universal scope explicit without changing witness dependence."
    },
    {
      "id": "C04",
      "status": "pass",
      "source_evidence": "The source starts with fair coin tosses and immediately afterward represents S_N using independent Bernoulli variables with parameter 1/2.",
      "translation_evidence": "Every coordinate is measurable, has the fair Bernoulli law on Bool, and the entire indexed family is jointly independent; the index cardinality is positive.",
      "reasoning": "The explicit and inherited hypotheses, including fairness, independence, and positive N, match."
    },
    {
      "id": "C05",
      "status": "pass",
      "source_evidence": "The displayed conclusions are exactly E[S_N] = N/2 and Var(S_N) = N/4.",
      "translation_evidence": "The reconstruction asserts both the expectation and variance identities for the same indicator sum.",
      "reasoning": "Both conclusions are present together and neither is weakened or omitted."
    },
    {
      "id": "C06",
      "status": "pass",
      "source_evidence": "S_N is the number of heads and is subsequently expressed as the sum of independent Bernoulli(1/2) head indicators.",
      "translation_evidence": "LocalDef001 maps true to 1 and false to 0, LocalDef002 is the Bernoulli(1/2) law, expectation is the integral, and variance is the standard real variance of the bounded finite sum.",
      "reasoning": "The anonymous definitions reconstruct the source's head indicators, fair Bernoulli law, expectation, and variance correctly."
    },
    {
      "id": "C07",
      "status": "pass",
      "source_evidence": "Both source moment statements are exact equalities.",
      "translation_evidence": "Both reconstructed conclusions are exact equalities.",
      "reasoning": "The relation strength is unchanged."
    },
    {
      "id": "C08",
      "status": "pass",
      "source_evidence": "The source distinguishes each Bernoulli indicator X_i from their sum S_N, which counts heads.",
      "translation_evidence": "The reconstruction distinguishes each Boolean variable B_i, its real 0-1 embedding, and the resulting finite sum S.",
      "reasoning": "Individual tosses, indicator values, and the total count retain their distinct roles."
    },
    {
      "id": "C09",
      "status": "pass",
      "source_evidence": "The source uses N tosses and the exact coefficients 1/2 for the expectation and 1/4 for the variance.",
      "translation_evidence": "The reconstruction uses the full finite index set, its cardinality, and the exact quotients |ι|/2 and |ι|/4.",
      "reasoning": "Cardinality, indexing range, and both numerical constants match exactly."
    },
    {
      "id": "C10",
      "status": "pass",
      "source_evidence": "The source indexes the tosses by the positive initial segment from 1 through N.",
      "translation_evidence": "The reconstruction permits any nonempty finite index type.",
      "reasoning": "This is an equivalent relabeling-invariant formulation: every nonempty finite index type has the cardinality of a positive finite initial segment."
    },
    {
      "id": "C11",
      "status": "pass",
      "source_evidence": "N is implicitly positive in the N-toss experiment and the subsequent sum from 1 to N.",
      "translation_evidence": "The condition 0 < |ι| explicitly excludes the empty index family.",
      "reasoning": "The translation handles the source's implicit positive-N boundary consistently."
    },
    {
      "id": "C12",
      "status": "pass",
      "source_evidence": "Independent fair coin tosses exist for every positive integer N, and their number of heads has the stated nontrivial moments.",
      "translation_evidence": "The hypotheses describe ordinary finite product Bernoulli experiments, and the conclusions concern their genuine indicator sum.",
      "reasoning": "The reconstructed proposition is satisfiable and its conclusions are not obtained through unintended vacuity."
    }
  ],
  "implications": {
    "translation_implies_source": {
      "verdict": "yes",
      "reasoning": "A nonempty finite jointly independent family of fair Boolean variables, converted to 0-1 indicators and summed, is precisely a positive finite fair-coin experiment, so the reconstructed moment identities give the source identities."
    },
    "source_implies_translation": {
      "verdict": "yes",
      "reasoning": "The source's N independent Bernoulli(1/2) head indicators can be indexed by a nonempty finite type, represented as Boolean variables, and summed through the true-to-1 indicator, yielding exactly the reconstructed expectation and variance statements."
    }
  },
  "classification": "faithful-equivalent",
  "accepted": true,
  "requires_adjudication": false,
  "findings": [
    {
      "severity": "note",
      "category": "finite-index-representation",
      "source_evidence": "The source uses indices 1 through N for an implicitly positive integer N.",
      "translation_evidence": "The reconstruction uses an arbitrary finite type with positive cardinality.",
      "impact": "This is a harmless equivalence under finite relabeling and does not change the mathematical content."
    },
    {
      "severity": "note",
      "category": "probability-model-made-explicit",
      "source_evidence": "The source describes fair coin tosses and then explicitly identifies independent Bernoulli(1/2) head indicators.",
      "translation_evidence": "The reconstruction states measurability, joint independence, and each marginal pushforward law explicitly.",
      "impact": "The formal probability-space details expose rather than strengthen the source's intended experiment."
    }
  ],
  "rationale": "The source and blind-translation hashes were verified. The anonymous reconstruction preserves the implicitly positive number of tosses, fairness, independence, the identity of S_N as the head-indicator sum, and both exact moment identities with coefficients 1/2 and 1/4. Its arbitrary nonempty finite index type is equivalent to the source's indexing by 1 through N. Both implication directions hold, so the reconstruction is faithful-equivalent and requires no adjudication."
}
