{"schema_version":"formalization-faithfulness-1","role":"roundtrip-judge","task_id":"HDP-01-THM-JENSEN","source_sha256":"855fdaf6870f664f1e470d47641b6d72758afdb9b87649a6494b027cecc02b17","blind_translation_sha256":"7c1709453873f961fda350da69a8de9a6c6d9a37f467f9dfd5f11669b06a3fae","semantic_checklist":[{"id":"C01","status":"pass","source_evidence":"The locator selects Jensen's inequality in Section 1.2 of the first edition and the excerpt states the displayed expectation inequality.","translation_evidence":"The translation reconstructs Jensen's inequality for a real-valued function on a probability-measure space.","reasoning":"The selected source result and reconstructed proposition concern the same named inequality and displayed mathematical relation."},{"id":"C02","status":"pass","source_evidence":"The source binds a real-valued random variable X and a convex function phi from Real to Real in a probability-space context.","translation_evidence":"The translation binds a measurable-space carrier, a probability measure, X : Omega -> Real, and phi : Real -> Real.","reasoning":"The principal object types match; the additional integrability premises are assessed separately as hypotheses and applicability restrictions."},{"id":"C03","status":"pass","source_evidence":"The source universally states the inequality for any random variable X and convex phi.","translation_evidence":"The translation universally quantifies the probability-space data, X, and phi before imposing its hypotheses.","reasoning":"Quantifier order and dependence are compatible: the same phi and X occur in the premises and conclusion."},{"id":"C04","status":"fail","source_evidence":"The printed source says any random variable X and convex phi, with no explicit assumptions that X or phi composed with X is integrable.","translation_evidence":"The translation explicitly assumes both Integrable X mu and Integrable (phi composed with X) mu.","reasoning":"These are substantive extra hypotheses. They restrict applicability and cannot be treated as a stronger conclusion."},{"id":"C05","status":"pass","source_evidence":"The source conclusion is phi(E X) <= E phi(X).","translation_evidence":"The translation concludes phi(integral X dmu) <= integral (phi composed with X) dmu.","reasoning":"Under the probability-measure interpretation of expectation, the sole displayed conclusion is completely represented."},{"id":"C06","status":"pass","source_evidence":"The source uses expectation and ordinary real convexity.","translation_evidence":"The dependency translation identifies the expectation-like operator as the real-valued Bochner integral and expands ConvexOn on the universal real set into the standard convex-combination inequality.","reasoning":"The operators used in the reconstructed proposition have the intended mathematical roles for the comparison, notwithstanding implementation details irrelevant under the explicit integrability assumptions."},{"id":"C07","status":"pass","source_evidence":"The source relation is the non-strict inequality phi(E X) <= E phi(X).","translation_evidence":"The translation has the same non-strict inequality direction between phi of the integral and the integral of phi composed with X.","reasoning":"Relation direction, strictness, and conclusion strength match on the translation's restricted domain."},{"id":"C08","status":"pass","source_evidence":"The source distinguishes X, phi, E X, and E phi(X).","translation_evidence":"The translation keeps X and phi distinct and separately forms the integral of X and the integral of phi composed with X.","reasoning":"No source object or transformed value is conflated."},{"id":"C09","status":"pass","source_evidence":"The source formula contains no numerical constants, coefficients, or indices beyond those implicit in convexity.","translation_evidence":"The translation reproduces the same expectation inequality and the standard convex-combination parameters for global convexity.","reasoning":"There is no consequential constant, exponent, or indexing mismatch."},{"id":"C10","status":"fail","source_evidence":"The source claim ranges over any random variable and convex real function without stated integrability restrictions.","translation_evidence":"The translation specializes to cases where both X and phi composed with X have finite integrals and the required measurability.","reasoning":"This is a reduced-applicability specialization of the printed claim, not a faithful generalization or genuine strengthening."},{"id":"C11","status":"fail","source_evidence":"The phrase any random variable does not exclude nonintegrable X or cases where phi(X) is nonintegrable, even though their expectations may require special interpretation.","translation_evidence":"The explicit integrability hypotheses exclude all such cases before the conclusion is available.","reasoning":"The source and translation handle the nonintegrable boundary cases differently; a possible defect or informality in the printed source must not be silently repaired during faithfulness judgment."},{"id":"C12","status":"pass","source_evidence":"Jensen's inequality is a substantive relation for ordinary random variables and convex functions.","translation_evidence":"The extra premises are satisfiable in standard probability spaces, for example for bounded real random variables and convex functions with integrable composition.","reasoning":"The reconstructed proposition is nonvacuous, although it covers fewer cases than the source wording."}],"implications":{"translation_implies_source":{"verdict":"no","reasoning":"The translation proves the inequality only when X and phi composed with X are both integrable, so it supplies no result for the additional random variables included by the source's unrestricted wording."},"source_implies_translation":{"verdict":"yes","reasoning":"Every case satisfying the translation's extra integrability assumptions is a case of the source's any-random-variable assertion, and the conclusions coincide under the probability-measure interpretation of expectation."}},"classification":"not-faithful-weaker","accepted":false,"requires_adjudication":false,"findings":[{"severity":"major","category":"reduced-applicability-integrability","source_evidence":"The source states Jensen's inequality for any random variable X and convex phi without explicit integrability qualifications.","translation_evidence":"The translation requires separate integrability of X and of phi composed with X.","impact":"The reconstructed proposition omits all nonintegrable cases claimed by the printed source, so it is a restricted and therefore weaker formalization rather than a stronger theorem."}],"rationale":"The translated conclusion faithfully reproduces Jensen's inequality on its stated domain, but its two explicit integrability hypotheses materially narrow the source's literal any-random-variable claim. Under the fixed policy, additional hypotheses are reduced applicability, so translation implies source is no, source implies translation is yes, and the correct classification is not-faithful-weaker."}
