{
  "schema_version": "formalization-faithfulness-1",
  "role": "roundtrip-judge",
  "task_id": "HDP-02-BODY-2.7-YOUNG",
  "source_sha256": "ecc53be86c091b5df118c4464b6d81672e0261df960a3f32ceea4900107d090a",
  "blind_translation_sha256": "4e37ccd5ee45144d691ca22f39d317f1f258f21320bff1b7a1bec34b0a8c910f",
  "semantic_checklist": [
    {"id":"C01","status":"pass","source_evidence":"PDF page 23, printed page 34, in the proof of Lemma 2.7.7 explicitly states Young's inequality ab ≤ a²/2 + b²/2 for a,b ∈ R.","translation_evidence":"The translation reconstructs exactly the universal real inequality identified by the selected passage.","reasoning":"The cited version, passage, enclosing proof, and deterministic context are correctly selected."},
    {"id":"C02","status":"pass","source_evidence":"The source explicitly binds a,b ∈ R.","translation_evidence":"The translation binds arbitrary real numbers a and b and identifies every arithmetic expression as real-valued.","reasoning":"The binders and their real-number types match exactly."},
    {"id":"C03","status":"pass","source_evidence":"The source states the inequality uniformly for a,b ∈ R, with no existential witness or nested quantifier dependence.","translation_evidence":"The translation says 'For every pair of real numbers a and b' and introduces no witnesses.","reasoning":"Universal scope over both variables is preserved."},
    {"id":"C04","status":"pass","source_evidence":"The displayed source inequality has no hypotheses beyond a,b ∈ R and is independent of the probabilistic assumptions used elsewhere in Lemma 2.7.7.","translation_evidence":"The translation lists no hypotheses and explicitly notes that a and b are unrestricted real numbers.","reasoning":"No additional, omitted, or inherited side condition changes the claim."},
    {"id":"C05","status":"pass","source_evidence":"The complete selected claim is the single inequality ab ≤ a²/2 + b²/2.","translation_evidence":"The sole translated conclusion is that ab is at most a²/2 + b²/2.","reasoning":"The entire conclusion is represented with no missing conjunct, case, or witness."},
    {"id":"C06","status":"pass","source_evidence":"The source uses ordinary real multiplication, squares, division by 2, addition, and order.","translation_evidence":"The translation and its dependency ledger interpret multiplication, natural powers, real division, addition, numerals, and ≤ as the ordinary real operations.","reasoning":"All operators and coercions receive the same mathematical interpretation as in the source."},
    {"id":"C07","status":"pass","source_evidence":"The source relation is the non-strict upper bound ab ≤ a²/2 + b²/2.","translation_evidence":"The translation preserves the non-strict ≤ direction and the same right-hand bound.","reasoning":"Relation direction, strictness, and strength match."},
    {"id":"C08","status":"pass","source_evidence":"The source has two arbitrary real objects a and b, whose product is compared with their respective squared terms.","translation_evidence":"The translation keeps a and b distinct and assigns each square and factor to the corresponding variable.","reasoning":"Object identity and roles are preserved without conflation."},
    {"id":"C09","status":"pass","source_evidence":"Each square has exponent 2 and coefficient 1/2: a²/2 + b²/2.","translation_evidence":"The translation uses natural exponent 2 and the fixed real denominator 2 for both terms; its equivalent form (a²+b²)/2 has the same exact coefficients.","reasoning":"All constants, exponents, and coefficients match exactly."},
    {"id":"C10","status":"pass","source_evidence":"The source domain is all pairs of real numbers.","translation_evidence":"The translation is universal over all pairs of real numbers, with no scalar-field or domain restriction or extension.","reasoning":"There is no specialization or generalization."},
    {"id":"C11","status":"pass","source_evidence":"The source permits every real a and b; division is only by the fixed nonzero constant 2, so no boundary or exceptional case is excluded.","translation_evidence":"The translation expressly notes that the denominator is the fixed nonzero real number 2 and that no exceptional case arises.","reasoning":"Degenerate values such as a=0 or b=0 remain included, and all operations are defined."},
    {"id":"C12","status":"pass","source_evidence":"The source assertion applies to every real pair and is a substantive inequality, with equality for examples such as a=b.","translation_evidence":"The translation has no premises and identifies the proposition as a concrete universal inequality rather than a vacuous implication.","reasoning":"The domain is inhabited and the assertion is nonvacuous."}
  ],
  "implications": {
    "translation_implies_source": {"verdict":"yes","reasoning":"The translated proposition universally quantifies over the same real variables and asserts exactly ab ≤ a²/2 + b²/2, so every instance of the translation is an instance of the source claim."},
    "source_implies_translation": {"verdict":"yes","reasoning":"The source supplies the same unrestricted universal real inequality with identical operators and constants; the translation adds no mathematical condition or conclusion beyond definitional explanations."}
  },
  "classification": "faithful-equivalent",
  "accepted": true,
  "requires_adjudication": false,
  "findings": [],
  "rationale": "The blind translation and authoritative source agree on the unrestricted real domain, universal quantification, absence of hypotheses, exact product, non-strict inequality, two squared terms, and coefficients 1/2. Both implication directions hold by direct identity up to the elementary algebraic reformulation a²/2+b²/2=(a²+b²)/2, and no uncertainty remains."
}
