{
  "schema_version": "formalization-faithfulness-1",
  "role": "roundtrip-judge",
  "task_id": "LEV-CH01-RIEMANN-INTERFACE-FLUX",
  "source_sha256": "b3adec0d3616dbde57a5522cfce1861890887d7c03a2232d2136cb94c9bac1d5",
  "blind_translation_sha256": "ea98f6647d30a21438dded5c1151c7ae61285ab619035bc121a7e8bc243cd808",
  "semantic_checklist": [
    {
      "id": "C01",
      "status": "pass",
      "source_evidence": "The paragraph after equation (1.11) uses adjacent averages Q_{i-1}, Q_i as Riemann data, extracts a numerical flux, and updates cell averages.",
      "translation_evidence": "The reconstructed checklist contains ordered interface data, a solver-information workflow, a flux-validation predicate, and a flux-difference update.",
      "reasoning": "The selected source process is recognizable."
    },
    {
      "id": "C02",
      "status": "pass",
      "source_evidence": "The source uses scalar or vector approximate cell averages on adjacent indexed cells.",
      "translation_evidence": "The reconstruction uses integer-indexed Fin m real-vector cell averages and an abstract information type.",
      "reasoning": "For positive m, the principal state and index types match."
    },
    {
      "id": "C03",
      "status": "fail",
      "source_evidence": "The source positively asserts the interface-solve-to-flux-to-update construction.",
      "translation_evidence": "The theorem only states LocalDef001 data if and only if LocalDef001's own defining checklist, with no hypothesis or conclusion that the checklist holds.",
      "reasoning": "The algorithmic assertion is replaced by an unfolding equivalence."
    },
    {
      "id": "C04",
      "status": "fail",
      "source_evidence": "The solver must be exact or suitably approximate, its result must yield a numerical approximation to physical interface flux, and the update occurs over a time step.",
      "translation_evidence": "Solver suitability and physical-flux approximation are arbitrary predicates; positivity of an uninterpreted scale is the only quantitative premise encoded in the checklist.",
      "reasoning": "The decisive hypotheses can be satisfied by declarations unrelated to the conservation law."
    },
    {
      "id": "C05",
      "status": "fail",
      "source_evidence": "The source concludes that actual Riemann information is used for a numerical flux and that the flux advances cell averages.",
      "translation_evidence": "Those conditions occur only inside the unasserted right side of a definitional iff.",
      "reasoning": "The source conclusions are not established for any data."
    },
    {
      "id": "C06",
      "status": "fail",
      "source_evidence": "A Riemann solver solves or suitably approximates the local hyperbolic problem, and a numerical flux approximates physical transfer through the interface.",
      "translation_evidence": "solve and fluxFromInformation are arbitrary functions, while suitableInformation and isPhysicalFluxApproximation are arbitrary predicates.",
      "reasoning": "The operator names and predicate slots do not enforce their source definitions."
    },
    {
      "id": "C07",
      "status": "fail",
      "source_evidence": "The passage makes a substantive numerical construction claim.",
      "translation_evidence": "The exact iff is true by the definition of LocalDef001, independent of whether any Riemann workflow is valid.",
      "reasoning": "The reconstructed proposition is strictly weaker."
    },
    {
      "id": "C08",
      "status": "pass",
      "source_evidence": "Q_{i-1} supplies the left state and Q_i the right state at interface i.",
      "translation_evidence": "The local datum uses U_{i-1} on x<0 and U_i on x>0, and the solver receives that ordered pair.",
      "reasoning": "The adjacent-state roles are preserved."
    },
    {
      "id": "C09",
      "status": "pass",
      "source_evidence": "The integral balance has incoming left flux and outgoing right flux; adjacent states are indexed i-1 and i.",
      "translation_evidence": "The reconstruction uses F_{i+1}-F_i inside U_i-scale*(F_{i+1}-F_i) and the correct adjacent-state offsets.",
      "reasoning": "The standard one-dimensional sign and indexing convention is consistent with the source."
    },
    {
      "id": "C10",
      "status": "fail",
      "source_evidence": "The source's state is scalar or a nonempty physical vector.",
      "translation_evidence": "m is any natural number, including m=0, where every componentwise update and state condition is vacuous.",
      "reasoning": "The zero-component generalization introduces an unintended domain."
    },
    {
      "id": "C11",
      "status": "fail",
      "source_evidence": "Exact and approximate Riemann solvers are both permitted, but each must supply suitable physical-flux information.",
      "translation_evidence": "The two mode labels are semantically hidden and arbitrary predicates can certify any solver or flux; the m=0 case is vacuous.",
      "reasoning": "Exceptional solver and degenerate-state cases are not faithfully constrained."
    },
    {
      "id": "C12",
      "status": "fail",
      "source_evidence": "The source process is substantive and depends on a suitable solver and physical numerical flux.",
      "translation_evidence": "The theorem follows by unfolding LocalDef001, even for nonsensical solver functions or with no positive-scale valid data instance.",
      "reasoning": "It is accidentally tautological relative to the source claim."
    },
    {
      "id": "N01",
      "status": "fail",
      "source_evidence": "Adjacent approximate cell averages feed a Riemann solve, its information feeds a numerical interface flux, and that flux feeds a time-step update.",
      "translation_evidence": "This chain appears syntactically in the checklist, but the theorem does not assert the checklist and all semantic validation is delegated to arbitrary predicates.",
      "reasoning": "Execution structure is present without guaranteed numerical meaning."
    },
    {
      "id": "N02",
      "status": "not-applicable",
      "source_evidence": "The selected passage states no norm or metric comparison.",
      "translation_evidence": "The reconstruction states none.",
      "reasoning": "This check does not apply."
    },
    {
      "id": "N03",
      "status": "not-applicable",
      "source_evidence": "No quantitative stability, consistency-error, or convergence theorem is stated here.",
      "translation_evidence": "The reconstruction states none.",
      "reasoning": "This check does not apply."
    },
    {
      "id": "N04",
      "status": "fail",
      "source_evidence": "Q_{i-1}, Q_i are approximate cell averages and the numerical flux approximates the correct physical interface flux.",
      "translation_evidence": "The approximation role is only an arbitrary predicate, with no equality, closeness, consistency, or physical-flux function.",
      "reasoning": "Exact and computed quantities are not semantically related."
    },
    {
      "id": "N05",
      "status": "not-applicable",
      "source_evidence": "No asymptotic solver-error term or order statement is selected.",
      "translation_evidence": "The reconstruction includes none.",
      "reasoning": "This check does not apply."
    },
    {
      "id": "N06",
      "status": "fail",
      "source_evidence": "Using Riemann information presupposes an exact or suitably approximate interface solve for the neighboring states.",
      "translation_evidence": "A total arbitrary function supplies Information for every pair, and an arbitrary predicate declares it suitable; no analytic existence or admissibility is enforced.",
      "reasoning": "Solver existence and suitability are bypassed."
    }
  ],
  "implications": {
    "translation_implies_source": {
      "verdict": "no",
      "reasoning": "The definitional iff holds for arbitrary solver and flux functions, arbitrary validation predicates, a scale unrelated to time or mesh width, and even zero-component states, so it does not establish a suitable Riemann solve, physical numerical flux, or cell-average time step."
    },
    "source_implies_translation": {
      "verdict": "yes",
      "reasoning": "LocalDef001 is defined as exactly the displayed checklist, making the reconstructed equivalence true for every record and therefore also for every source-compatible interface-flux construction."
    }
  },
  "classification": "not-faithful-weaker",
  "accepted": false,
  "requires_adjudication": false,
  "findings": [
    {
      "severity": "major",
      "category": "unasserted-riemann-workflow-with-opaque-validation",
      "source_evidence": "The source requires ordered neighboring cell averages, an exact or suitable approximate Riemann solve, a numerical approximation to physical interface flux, and use of that flux in a time-step update.",
      "translation_evidence": "The theorem only unfolds a predicate whose solver, information-to-flux map, and validation predicates are arbitrary record fields.",
      "impact": "It is true for workflows unrelated to the conservation law and proves no instance of the source construction."
    }
  ],
  "rationale": "The right-hand checklist contains the correct ordering and stencil, but the proposition merely unfolds a definition and leaves all Riemann and physical-flux semantics opaque. It is strictly weaker."
}
