{
  "schema_version": "formalization-faithfulness-1",
  "role": "roundtrip-judge",
  "task_id": "HDP-02-DEF-2.2.1",
  "source_sha256": "ecc53be86c091b5df118c4464b6d81672e0261df960a3f32ceea4900107d090a",
  "blind_translation_sha256": "5f3f28d6bc11013568e3993e9b7732d98f52af5c15230f0bb2a010657b16312a",
  "semantic_checklist": [
    {
      "id": "C01",
      "status": "pass",
      "source_evidence": "PDF page 4/printed page 15 contains Definition 2.2.1 and the immediately following affine equivalence, before Theorem 2.2.2.",
      "translation_evidence": "The translation contains only a symmetric real two-point law and its characterization as the pushforward of a Boolean Bernoulli law.",
      "reasoning": "The selected definition and affine-equivalence boundary are preserved without importing the subsequent Hoeffding inequality."
    },
    {
      "id": "C02",
      "status": "pass",
      "source_evidence": "The source describes scalar-valued random variables X and Z on an implicit probability space.",
      "translation_evidence": "The translation works at the level of probability mass functions: a distinguished PMF on Real and Boolean Bernoulli PMFs parameterized by p∈NNReal with p≤1.",
      "reasoning": "The source assertions are purely distributional, so replacing random variables by their laws and encoding the usual two outcomes by Bool preserves the mathematical types and roles."
    },
    {
      "id": "C03",
      "status": "pass",
      "source_evidence": "The definition fixes the symmetric law, and the following sentence states an if-and-only-if affine relationship for the usual Bernoulli(1/2) law.",
      "translation_evidence": "The first two conjuncts fix the distinguished law's masses, while the third universally quantifies valid p and states that its transformed Bernoulli(p) law equals the distinguished law iff p=1/2.",
      "reasoning": "The target makes the source's bidirectional distributional characterization parameter-explicit; the parameter and its validity condition are scoped correctly."
    },
    {
      "id": "C04",
      "status": "pass",
      "source_evidence": "The source implicitly requires valid probability laws and fixes the ordinary Bernoulli parameter to 1/2.",
      "translation_evidence": "The translation uses p∈NNReal, where 0≤p is built in, and explicitly assumes p≤1 before constructing Bernoulli(p).",
      "reasoning": "These are exactly the standard admissibility conditions for a Bernoulli probability parameter and introduce no unintended restriction."
    },
    {
      "id": "C05",
      "status": "pass",
      "source_evidence": "Definition 2.2.1 requires the values -1 and 1 with probability 1/2 each, and the following paragraph gives the Bernoulli(1/2) affine equivalence.",
      "translation_evidence": "The translation states both mass equalities, defines the distinguished law as the fair Boolean Bernoulli pushforward, and gives the corresponding iff characterization among all valid Bernoulli parameters.",
      "reasoning": "The support property follows from the supplied pushforward definition, both atom probabilities are explicit, and the affine characterization is present. The alternative name Rademacher is terminology rather than a separate mathematical condition."
    },
    {
      "id": "C06",
      "status": "pass",
      "source_evidence": "The source uses ordinary Bernoulli(1/2), symmetric Bernoulli distribution, atom probabilities, and the transform Z=2X-1.",
      "translation_evidence": "PMF.bernoulli has true mass p and false mass 1-p; PMF.map pushes it forward by false↦-1 and true↦1; PMF equality is equality of complete laws; PMF evaluation gives ENNReal atom masses.",
      "reasoning": "Under the standard Boolean encoding false=0 and true=1, the supplied map is exactly x↦2x-1. Every nontrivial operator and local definition has the intended distributional meaning."
    },
    {
      "id": "C07",
      "status": "pass",
      "source_evidence": "The atom probabilities are exact equalities, and the affine relationship is explicitly an if-and-only-if statement.",
      "translation_evidence": "The translation uses exact PMF mass equalities and an Iff between transformed-law equality and p=1/2.",
      "reasoning": "Equality strength and both directions of the affine characterization match; no implication is weakened or made one-sided."
    },
    {
      "id": "C08",
      "status": "pass",
      "source_evidence": "X is the usual Bernoulli variable and Z=2X-1 is its transformed symmetric variable.",
      "translation_evidence": "The Boolean Bernoulli(p) PMF is the pre-transformation law, while the distinguished real PMF is the pushforward law under false↦-1 and true↦1.",
      "reasoning": "The original and transformed laws remain distinct and are related by pushforward rather than conflated."
    },
    {
      "id": "C09",
      "status": "pass",
      "source_evidence": "The source uses outcomes exactly -1 and 1, probabilities exactly 1/2, parameter exactly 1/2, and transform exactly 2X-1.",
      "translation_evidence": "The translation uses real outcomes -1 and 1, ENNReal masses 1/2, NNReal parameter 1/2, and the Boolean map false↦-1 and true↦1.",
      "reasoning": "All signs, constants, outcome correspondences, and parameter values agree exactly."
    },
    {
      "id": "C10",
      "status": "pass",
      "source_evidence": "The source leaves the probability space and scalar implementation implicit but states only distributional facts about a two-point law.",
      "translation_evidence": "The translation specializes to a concrete PMF on Real and represents the ordinary Bernoulli law on Bool.",
      "reasoning": "This is a faithful law-level representation: Bool supplies precisely the two usual Bernoulli outcomes, and its real pushforward supplies precisely the two symmetric outcomes."
    },
    {
      "id": "C11",
      "status": "pass",
      "source_evidence": "Both two-point outcomes have positive mass 1/2, and the affine equivalence concerns the valid parameter 1/2.",
      "translation_evidence": "The characterization covers all p∈[0,1], including p=0 and p=1, and identifies equality with the symmetric law exactly at p=1/2.",
      "reasoning": "Degenerate endpoint Bernoulli laws are correctly excluded by the iff rather than by an undefined operation, and no exceptional outcome or parameter case is mishandled."
    },
    {
      "id": "C12",
      "status": "pass",
      "source_evidence": "The symmetric two-point distribution and the usual Bernoulli(1/2) distribution are genuine probability laws.",
      "translation_evidence": "The distinguished PMF is explicitly constructed as the pushforward of Bernoulli(1/2), and p=1/2 is a valid witness satisfying p≤1.",
      "reasoning": "The statement is satisfiable and nonvacuous; its mass equalities and iff describe a genuine nondegenerate two-point law."
    }
  ],
  "implications": {
    "translation_implies_source": {
      "verdict": "yes",
      "reasoning": "The distinguished PMF is the pushforward of fair Boolean Bernoulli by false↦-1 and true↦1, so it is supported on exactly -1 and 1 and assigns each mass 1/2. This is the source's symmetric Bernoulli, or Rademacher, law. The parameter characterization specializes at p=1/2 to the forward affine conversion and, in the reverse direction, identifies the pre-transformation law as the usual Bernoulli(1/2) law."
    },
    "source_implies_translation": {
      "verdict": "yes",
      "reasoning": "Encoding a usual Bernoulli variable's values 0 and 1 by false and true turns Z=2X-1 into the map false↦-1 and true↦1. Definition 2.2.1 gives the two target atom masses. Its affine iff implies that the transformed Bernoulli(p) law is symmetric exactly when its preimage law is Bernoulli(1/2), equivalently p=1/2, yielding the translation's parameterized characterization."
    }
  },
  "classification": "faithful-equivalent",
  "accepted": true,
  "requires_adjudication": false,
  "findings": [],
  "rationale": "The anonymous reconstruction faithfully represents Definition 2.2.1 at the level of laws. Its distinguished real PMF is exactly the fair Boolean Bernoulli law pushed through the affine recoding of 0 and 1 to -1 and 1, so its support and two masses match the symmetric Bernoulli distribution. The universally parameterized iff is the source's affine Bernoulli(1/2) equivalence made explicit across valid Bernoulli parameters, not an additional substantive claim. Both implication directions hold, all C01-C12 checks pass, and no adjudication is required."
}
