{"schema_version":"formalization-faithfulness-1","role":"roundtrip-judge","task_id":"HDP-01-EQ-1.3-OBSTRUCTION","source_sha256":"855fdaf6870f664f1e470d47641b6d72758afdb9b87649a6494b027cecc02b17","blind_translation_sha256":"a58f6c80802ea5a9ca74286e6443f74e2d9a3f86887ec1929fcd26a729607907","semantic_checklist":[{"id":"C01","status":"pass","source_evidence":"The selected first-edition passage contains the finite-p definition with exponent 1/p for p in (0,infinity) and Equation (1.3) printed for 0<=p<=q<=infinity.","translation_evidence":"The translation is evaluated specifically as an arithmetic obstruction to the printed p=0 endpoint.","reasoning":"The locator selects the exact definition and equation needed to identify the endpoint defect."},{"id":"C02","status":"fail","source_evidence":"The source claim involves a random variable X, parameters p and q, and Lp quantities.","translation_evidence":"The translation binds only a real number r in a negated existential.","reasoning":"The source binders and mathematical objects are not represented; r only models a prospective reciprocal of zero."},{"id":"C03","status":"fail","source_evidence":"Equation (1.3) is stated for any parameters satisfying 0<=p<=q<=infinity.","translation_evidence":"The translation asserts not exists r:Real, 0*r=1.","reasoning":"A parameterized universal inequality and a negated existential arithmetic statement have different quantifier structures."},{"id":"C04","status":"fail","source_evidence":"The finite-p norm is defined only for p>0, while Equation (1.3) includes the boundary p=0 and requires p<=q.","translation_evidence":"The translation fixes zero directly and has no hypotheses involving p, q, X, or integrability.","reasoning":"It captures why a reciprocal exponent fails at zero but does not preserve the source conditions."},{"id":"C05","status":"fail","source_evidence":"The printed conclusion is the monotonicity inequality norm(X,Lp)<=norm(X,Lq).","translation_evidence":"The sole conclusion is that no real r satisfies 0*r=1.","reasoning":"The inequality conclusion is absent; the translation supplies only evidence for one obstruction to interpreting its p=0 case."},{"id":"C06","status":"fail","source_evidence":"The source uses expectation, absolute value, real exponentiation by 1/p, essential supremum, and Lp notation.","translation_evidence":"The translation interprets real zero, one, multiplication, equality, existential quantification, and negation.","reasoning":"Real multiplication correctly characterizes a reciprocal candidate, but the substantive Lp operators and definitions are not translated."},{"id":"C07","status":"fail","source_evidence":"The source asserts a non-strict inequality between two Lp quantities.","translation_evidence":"The translation denies existence of a solution to an equality.","reasoning":"The principal relation and conclusion strength do not match."},{"id":"C08","status":"fail","source_evidence":"X is a random variable, p and q are norm parameters, and the compared objects are norm(X,Lp) and norm(X,Lq).","translation_evidence":"r is only a candidate real reciprocal of zero.","reasoning":"The candidate reciprocal is relevant diagnostic evidence but is not any of the source's principal objects."},{"id":"C09","status":"fail","source_evidence":"The source depends on the exponents 1/p and q/p and on the range 0<=p<=q<=infinity.","translation_evidence":"The translation retains only the constants 0 and 1 in 0*r=1.","reasoning":"It isolates the missing reciprocal at p=0 but omits q, the exponent formulas, and all parameter dependence."},{"id":"C10","status":"fail","source_evidence":"The source concerns Lp quantities of random variables with finite and infinite parameter cases.","translation_evidence":"The translation is a standalone statement in the real numbers.","reasoning":"This is a change from probability-space/Lp semantics to an underlying real-arithmetic lemma, not a faithful restatement of the source result."},{"id":"C11","status":"pass","source_evidence":"The finite-p formula explicitly excludes p=0, although Equation (1.3) prints p=0 as an allowed endpoint.","translation_evidence":"The translation proves that zero has no real multiplicative reciprocal.","reasoning":"It correctly isolates the exceptional arithmetic obstruction to assigning a real value to 1/0 in the printed endpoint formula."},{"id":"C12","status":"pass","source_evidence":"The defect arises from the genuinely exceptional p=0 boundary, not from inconsistent hypotheses.","translation_evidence":"The negated existential has no hypotheses and substantively rules out every real reciprocal candidate.","reasoning":"The obstruction statement is nonvacuous, even though it does not encode the complete source claim."}],"implications":{"translation_implies_source":{"verdict":"no","reasoning":"The absence of a real reciprocal of zero explains why the finite-p expression with exponent 1/p cannot be instantiated at p=0, but it does not establish the printed Lp monotonicity inequality or any of its random-variable cases."},"source_implies_translation":{"verdict":"no","reasoning":"The printed monotonicity assertion does not state or derive the standalone nonexistence of a real reciprocal of zero; moreover, its p=0 instance lacks meaning under the immediately preceding definition."}},"classification":"not-faithful-different","accepted":false,"requires_adjudication":false,"findings":[{"severity":"critical","category":"undefined-boundary-case","source_evidence":"The Lp formula with exponent 1/p is defined for p>0, but Equation (1.3) includes p=0.","translation_evidence":"No real r satisfies 0*r=1.","impact":"The translation convincingly diagnoses the reciprocal obstruction at the defective endpoint, but it cannot turn the printed p=0 expression into a well-defined inequality."},{"severity":"major","category":"missing-source-conclusion","source_evidence":"Equation (1.3) concludes norm(X,Lp)<=norm(X,Lq) for the printed parameter range.","translation_evidence":"No Lp quantity, random variable, q parameter, or inequality appears in the translation.","impact":"The translated proposition is an obstruction certificate rather than a formalization of the printed result."},{"severity":"note","category":"relevant-obstruction-evidence","source_evidence":"The source's finite-p definition requires the exponent 1/p.","translation_evidence":"The translation rules out a real value r behaving as 1/0.","impact":"This is mathematically relevant evidence supporting a correction that excludes p=0, despite not being source-equivalent."}],"rationale":"The blind translation faithfully expresses the elementary real-arithmetic fact that zero has no reciprocal. That fact is strong, relevant evidence for the defect in applying the source's finite-p Lp formula at p=0. It nevertheless does not represent Equation (1.3): it omits the random variable, Lp quantities, parameters, domain conditions, and monotonicity conclusion. The two statements therefore differ semantically in both implication directions."}
